[
  {
    "id": "q-placement-b1",
    "title": "入学测评 · B1 自检",
    "skill": "quiz",
    "level": "B1",
    "questions": [
      {
        "q": "Which is correct? \"She ___ to the gym every morning.\"",
        "options": [
          "goes",
          "go",
          "going",
          "gone"
        ],
        "answer": 0
      },
      {
        "q": "\"Comprehensible input\" means:",
        "options": [
          "memorizing lists",
          "translating word by word",
          "input slightly above your level",
          "skipping grammar"
        ],
        "answer": 2
      },
      {
        "q": "Choose the synonym of \"fluency\":",
        "options": [
          "hesitation",
          "smoothness",
          "confusion",
          "silence"
        ],
        "answer": 1
      },
      {
        "q": "\"Shadowing\" is a training method for:",
        "options": [
          "vocabulary",
          "grammar rules",
          "reading speed",
          "speaking & pronunciation"
        ],
        "answer": 3
      }
    ]
  },
  {
    "id": "q-weekly-b2",
    "title": "周复盘 · B2 巩固",
    "skill": "quiz",
    "level": "B2",
    "questions": [
      {
        "q": "\"Deliberate practice\" emphasizes:",
        "options": [
          "targeting weak points",
          "long hours",
          "passive listening",
          "memorizing rules"
        ],
        "answer": 0
      },
      {
        "q": "Which improves long-term retention most?",
        "options": [
          "re-reading",
          "highlighting",
          "active recall",
          "watching videos"
        ],
        "answer": 2
      },
      {
        "q": "\"Cohesion\" in writing refers to:",
        "options": [
          "word length",
          "spelling",
          "punctuation",
          "linking ideas smoothly"
        ],
        "answer": 3
      }
    ]
  },
  {
    "id": "q-vocab-school",
    "title": "学校词汇测验 · A2/B1",
    "skill": "quiz",
    "level": "B1",
    "questions": [
      {
        "q": "\"Submit your ___ before the deadline.\" 应选：",
        "options": [
          "scholarship",
          "assignment",
          "syllabus",
          "cadence"
        ],
        "answer": 1
      },
      {
        "q": "\"She ___ in the online course last month.\" 应选：",
        "options": [
          "enrolls",
          "enroll",
          "enrolled",
          "enrolling"
        ],
        "answer": 2
      },
      {
        "q": "避免抄袭应做的是：",
        "options": [
          "复制粘贴",
          "隐藏来源",
          "改写不改出处",
          "cite sources"
        ],
        "answer": 3
      },
      {
        "q": "\"Extracurricular\" 意思是：",
        "options": [
          "课外的",
          "课内的",
          "必修的",
          "考试的"
        ],
        "answer": 0
      }
    ]
  },
  {
    "id": "q-method-b2",
    "title": "学习方法 · B2 巩固",
    "skill": "quiz",
    "level": "B2",
    "questions": [
      {
        "q": "哪种最利于长期记忆？",
        "options": [
          "反复阅读",
          "主动回忆",
          "划重点",
          "看视频"
        ],
        "answer": 1
      },
      {
        "q": "费曼技巧的核心是：",
        "options": [
          "用大白话说清以暴露盲区",
          "背定义",
          "刷题",
          "记笔记"
        ],
        "answer": 0
      },
      {
        "q": "交错练习（interleaving）指：",
        "options": [
          "长时间单刷一种",
          "只练弱项",
          "混合技能交替练",
          "不复习"
        ],
        "answer": 2
      },
      {
        "q": "番茄工作法一个「番茄」通常多长？",
        "options": [
          "5 分钟",
          "1 小时",
          "25 分钟",
          "一整天"
        ],
        "answer": 2
      }
    ]
  },
  {
    "id": "q-vocab-daily-a1",
    "title": "日常高频词 · A1",
    "skill": "quiz",
    "level": "A1",
    "questions": [
      {
        "q": "“苹果”的英文是：",
        "options": [
          "apple",
          "bread",
          "milk",
          "rice"
        ],
        "answer": 0
      },
      {
        "q": "“火车”的英文是：",
        "options": [
          "bus",
          "taxi",
          "train",
          "bike"
        ],
        "answer": 2
      },
      {
        "q": "“老师”的英文是：",
        "options": [
          "student",
          "teacher",
          "doctor",
          "boss"
        ],
        "answer": 1
      },
      {
        "q": "“水”的英文是：",
        "options": [
          "milk",
          "tea",
          "coffee",
          "water"
        ],
        "answer": 3
      }
    ]
  },
  {
    "id": "q-travel-a2",
    "title": "旅行英语 · A2",
    "skill": "quiz",
    "level": "A2",
    "questions": [
      {
        "q": "在机场要出示的证件是：",
        "options": [
          "ticket",
          "passport",
          "luggage",
          "map"
        ],
        "answer": 1
      },
      {
        "q": "“行李”的英文是：",
        "options": [
          "luggage",
          "journey",
          "flight",
          "hotel"
        ],
        "answer": 0
      },
      {
        "q": "“到达”的英文动词是：",
        "options": [
          "leave",
          "arrive",
          "travel",
          "visit"
        ],
        "answer": 1
      },
      {
        "q": "“预订（酒店）”用哪个词？",
        "options": [
          "reservation",
          "station",
          "schedule",
          "discount"
        ],
        "answer": 0
      }
    ]
  },
  {
    "id": "q-work-b1",
    "title": "职场英语 · B1",
    "skill": "quiz",
    "level": "B1",
    "questions": [
      {
        "q": "“同事”的英文是：",
        "options": [
          "boss",
          "colleague",
          "salary",
          "interview"
        ],
        "answer": 1
      },
      {
        "q": "“升职”的英文是：",
        "options": [
          "resign",
          "deadline",
          "promotion",
          "schedule"
        ],
        "answer": 2
      },
      {
        "q": "“辞职”的英文是：",
        "options": [
          "retire",
          "resign",
          "hire",
          "fire"
        ],
        "answer": 1
      },
      {
        "q": "“责任”的英文是：",
        "options": [
          "responsibility",
          "qualification",
          "appointment",
          "budget"
        ],
        "answer": 0
      }
    ]
  },
  {
    "id": "q-health-b1",
    "title": "健康与就医 · B1",
    "skill": "quiz",
    "level": "B1",
    "questions": [
      {
        "q": "“症状”的英文是：",
        "options": [
          "symptom",
          "diet",
          "therapy",
          "medicine"
        ],
        "answer": 0
      },
      {
        "q": "“预约（医生）”用哪个词？",
        "options": [
          "interview",
          "appointment",
          "meeting",
          "schedule"
        ],
        "answer": 1
      },
      {
        "q": "“康复”的英文动词是：",
        "options": [
          "hurt",
          "ache",
          "recover",
          "cure"
        ],
        "answer": 2
      },
      {
        "q": "“均衡饮食”是：",
        "options": [
          "fast food",
          "big meal",
          "junk food",
          "balanced diet"
        ],
        "answer": 3
      }
    ]
  },
  {
    "id": "q-tech-b2",
    "title": "科技与隐私 · B2",
    "skill": "quiz",
    "level": "B2",
    "questions": [
      {
        "q": "“算法”的英文是：",
        "options": [
          "algorithm",
          "algebra",
          "device",
          "data"
        ],
        "answer": 0
      },
      {
        "q": "“隐私”的英文是：",
        "options": [
          "private",
          "privacy",
          "secret",
          "policy"
        ],
        "answer": 1
      },
      {
        "q": "推荐算法主要预测什么？",
        "options": [
          "你的位置",
          "你的年龄",
          "什么能吸引你的注意",
          "天气"
        ],
        "answer": 2
      },
      {
        "q": "“人工智能”的英文缩写是：",
        "options": [
          "IT",
          "APP",
          "VR",
          "AI"
        ],
        "answer": 3
      }
    ]
  },
  {
    "id": "q-nature-b2",
    "title": "自然与环境 · B2",
    "skill": "quiz",
    "level": "B2",
    "questions": [
      {
        "q": "“生态系统”的英文是：",
        "options": [
          "economy",
          "ecosystem",
          "species",
          "climate"
        ],
        "answer": 1
      },
      {
        "q": "珊瑚白化的主要原因是：",
        "options": [
          "船只污染",
          "海水变暖",
          "鱼类过多",
          "缺少阳光"
        ],
        "answer": 1
      },
      {
        "q": "“干旱”的英文是：",
        "options": [
          "flood",
          "storm",
          "drought",
          "humid"
        ],
        "answer": 2
      },
      {
        "q": "“濒危物种”的英文是：",
        "options": [
          "endangered species",
          "rare species",
          "wild species",
          "marine species"
        ],
        "answer": 0
      }
    ]
  },
  {
    "id": "q-academic-c1",
    "title": "学术英语 · C1",
    "skill": "quiz",
    "level": "C1",
    "questions": [
      {
        "q": "“实证的”英文是：",
        "options": [
          "empirical",
          "theoretical",
          "hypothetical",
          "rhetorical"
        ],
        "answer": 0
      },
      {
        "q": "“学位论文”的英文是：",
        "options": [
          "essay",
          "dissertation",
          "lecture",
          "syllabus"
        ],
        "answer": 1
      },
      {
        "q": "“综合（多方资料）”的英文动词是：",
        "options": [
          "summarize",
          "paraphrase",
          "synthesize",
          "infer"
        ],
        "answer": 2
      },
      {
        "q": "“细微差别”的英文是：",
        "options": [
          "difference",
          "ambiguity",
          "discrepancy",
          "nuance"
        ],
        "answer": 3
      }
    ]
  },
  {
    "id": "q-culture-c2",
    "title": "高阶文化词 · C2",
    "skill": "quiz",
    "level": "C2",
    "questions": [
      {
        "q": "“意外之喜”的英文是：",
        "options": [
          "serendipity",
          "ephemera",
          "idyllic",
          "vicissitude"
        ],
        "answer": 0
      },
      {
        "q": "“言简意赅的”最接近：",
        "options": [
          "garrulous",
          "laconic",
          "eloquent",
          "verbose"
        ],
        "answer": 1
      },
      {